{"schema_version":"1.0.0","purpose":"A portable copy of the learning goals and preferences you entered.","limitations":["These choices are not evidence of competency or mastery.","These choices do not grant permission or change course requirements."],"exported_at":"2026-10-17T18:05:00Z","profile":{"schema_version":"1.0.0","profile_id":"profile.local-learner","learner_id":"11111111-1111-4111-8111-111111111111","revision":4,"goals":[{"goal_id":"goal.research-literacy","title":"Understand how financial evidence is tested","detail":"Practice checking assumptions, sources, and limitations.","archived":false,"created_at":"2026-10-17T18:01:00Z","updated_at":"2026-10-17T18:01:00Z"}],"experience":[{"experience_id":"experience.python","subject":"Python for data analysis","level":"some_experience","detail":"I have used notebooks for class exercises.","created_at":"2026-10-17T18:02:00Z","updated_at":"2026-10-17T18:02:00Z"}],"interests":[{"interest_id":"interest.market-structure","label":"How markets match buyers and sellers","created_at":"2026-10-17T18:03:00Z","updated_at":"2026-10-17T18:03:00Z"}],"created_at":"2026-10-17T18:00:00Z","updated_at":"2026-10-17T18:03:00Z","profile_digest":"3bafc94452c22184dfab79023d6659c571aca1cab02d00f55f0624daadc7088e"},"history":{"schema_version":"1.0.0","profile_id":"profile.local-learner","current_revision":4,"changes":[{"schema_version":"1.0.0","revision":2,"operation":"create_goal","object_kind":"goal","object_id":"goal.research-literacy","occurred_at":"2026-10-17T18:01:00Z","resulting_profile_digest":"aaaaaaaaaaaaaaaaaaaaaaaaaaaaaaaaaaaaaaaaaaaaaaaaaaaaaaaaaaaaaaaa"},{"schema_version":"1.0.0","revision":3,"operation":"create_experience","object_kind":"experience","object_id":"experience.python","occurred_at":"2026-10-17T18:02:00Z","resulting_profile_digest":"bbbbbbbbbbbbbbbbbbbbbbbbbbbbbbbbbbbbbbbbbbbbbbbbbbbbbbbbbbbbbbbb"},{"schema_version":"1.0.0","revision":4,"operation":"create_interest","object_kind":"interest","object_id":"interest.market-structure","occurred_at":"2026-10-17T18:03:00Z","resulting_profile_digest":"3bafc94452c22184dfab79023d6659c571aca1cab02d00f55f0624daadc7088e"}]}}
